{
  "schema_version": "0.1",
  "catalog_id": "fixture-catalog-v1",
  "source": "usda_fndds_2021_2023_reviewed_subset",
  "fixture_note": "Deterministic USDA FNDDS 2021-2023 reviewed subset for tests, demos, and evaluation-driven resolver coverage. FNDDS nutrient values are per 100g; household-unit conversions come from FNDDS portions and weights where available. Added sugar uses a documented proxy because FNDDS At A Glance does not publish added-sugar grams.",
  "foods": [
    {
      "food_id": "oatmeal_cooked_plain",
      "name": "cooked oatmeal",
      "aliases": [
        "oatmeal",
        "plain oatmeal",
        "Oatmeal, regular or quick, made with water, no added fat"
      ],
      "base_quantity_g": 100,
      "nutrients_per_100g": {
        "energy_kcal": 64,
        "protein_g": 2.2,
        "carbohydrate_g": 11.4,
        "fat_g": 1.1,
        "saturated_fat_g": 0.2,
        "sodium_mg": 70,
        "added_sugar_g": 0,
        "fiber_g": 1.7
      },
      "unit_conversions": {
        "cup": 240,
        "g": 1,
        "oz": 28.35,
        "serving": 240
      },
      "allergens": [],
      "food_groups": [
        "whole_grains"
      ],
      "source_refs": [
        {
          "source": "fndds-2021-2023",
          "source_id": "56203056",
          "data_type": "FNDDS At A Glance",
          "note": "4802 Oatmeal"
        }
      ]
    },
    {
      "food_id": "blueberries_raw",
      "name": "blueberries",
      "aliases": [
        "blueberry",
        "Blueberries, raw"
      ],
      "base_quantity_g": 100,
      "nutrients_per_100g": {
        "energy_kcal": 64,
        "protein_g": 0.7,
        "carbohydrate_g": 14.6,
        "fat_g": 0.3,
        "saturated_fat_g": 0.0,
        "sodium_mg": 0,
        "added_sugar_g": 0,
        "fiber_g": 2.4
      },
      "unit_conversions": {
        "cup": 150,
        "g": 1,
        "oz": 28.35,
        "serving": 150
      },
      "allergens": [],
      "food_groups": [
        "fruits"
      ],
      "source_refs": [
        {
          "source": "fndds-2021-2023",
          "source_id": "63203010",
          "data_type": "FNDDS At A Glance",
          "note": "6011 Blueberries and other berries"
        }
      ]
    },
    {
      "food_id": "greek_yogurt_plain",
      "name": "plain Greek yogurt",
      "aliases": [
        "greek yogurt",
        "Yogurt, Greek, NS as to type of milk, plain"
      ],
      "base_quantity_g": 100,
      "nutrients_per_100g": {
        "energy_kcal": 67,
        "protein_g": 10.2,
        "carbohydrate_g": 3.6,
        "fat_g": 1.4,
        "saturated_fat_g": 0.7,
        "sodium_mg": 36,
        "added_sugar_g": 0,
        "fiber_g": 0
      },
      "unit_conversions": {
        "cup": 245,
        "g": 1,
        "oz": 28.35,
        "serving": 245
      },
      "allergens": [
        "milk"
      ],
      "food_groups": [
        "dairy"
      ],
      "source_refs": [
        {
          "source": "fndds-2021-2023",
          "source_id": "11411390",
          "data_type": "FNDDS At A Glance",
          "note": "1822 Yogurt, Greek"
        }
      ]
    },
    {
      "food_id": "chicken_breast_cooked",
      "name": "chicken breast",
      "aliases": [
        "cooked chicken breast",
        "grilled chicken breast",
        "baked chicken breast",
        "Chicken breast, baked, broiled, or roasted, skin not eaten, from raw"
      ],
      "base_quantity_g": 100,
      "nutrients_per_100g": {
        "energy_kcal": 161,
        "protein_g": 30.2,
        "carbohydrate_g": 0,
        "fat_g": 3.5,
        "saturated_fat_g": 0.8,
        "sodium_mg": 360,
        "added_sugar_g": 0,
        "fiber_g": 0
      },
      "unit_conversions": {
        "cup": 135,
        "g": 1,
        "oz": 28.35,
        "serving": 135
      },
      "allergens": [],
      "food_groups": [
        "fats",
        "protein"
      ],
      "source_refs": [
        {
          "source": "fndds-2021-2023",
          "source_id": "24122131",
          "data_type": "FNDDS At A Glance",
          "note": "2202 Chicken, whole pieces"
        }
      ]
    },
    {
      "food_id": "brown_rice_cooked",
      "name": "brown rice",
      "aliases": [
        "cooked brown rice",
        "Rice, brown, cooked, NS as to fat"
      ],
      "base_quantity_g": 100,
      "nutrients_per_100g": {
        "energy_kcal": 123,
        "protein_g": 2.4,
        "carbohydrate_g": 25.8,
        "fat_g": 1.1,
        "saturated_fat_g": 0.2,
        "sodium_mg": 201,
        "added_sugar_g": 0,
        "fiber_g": 1
      },
      "unit_conversions": {
        "cup": 196,
        "g": 1,
        "oz": 28.35,
        "serving": 196
      },
      "allergens": [],
      "food_groups": [
        "whole_grains"
      ],
      "source_refs": [
        {
          "source": "fndds-2021-2023",
          "source_id": "56205011",
          "data_type": "FNDDS At A Glance",
          "note": "4002 Rice"
        }
      ]
    },
    {
      "food_id": "broccoli_cooked",
      "name": "broccoli",
      "aliases": [
        "cooked broccoli",
        "Broccoli, fresh, cooked, no added fat"
      ],
      "base_quantity_g": 100,
      "nutrients_per_100g": {
        "energy_kcal": 41,
        "protein_g": 2.7,
        "carbohydrate_g": 6.5,
        "fat_g": 0.3,
        "saturated_fat_g": 0.0,
        "sodium_mg": 158,
        "added_sugar_g": 0,
        "fiber_g": 2.5
      },
      "unit_conversions": {
        "cup": 155,
        "g": 1,
        "oz": 28.35,
        "piece": 10,
        "serving": 155
      },
      "allergens": [],
      "food_groups": [
        "vegetables"
      ],
      "source_refs": [
        {
          "source": "fndds-2021-2023",
          "source_id": "72201211",
          "data_type": "FNDDS At A Glance",
          "note": "6407 Broccoli"
        }
      ]
    },
    {
      "food_id": "salmon_cooked",
      "name": "salmon",
      "aliases": [
        "cooked salmon",
        "baked salmon",
        "Fish, salmon, baked or broiled"
      ],
      "base_quantity_g": 100,
      "nutrients_per_100g": {
        "energy_kcal": 274,
        "protein_g": 25.4,
        "carbohydrate_g": 0.0,
        "fat_g": 18.4,
        "saturated_fat_g": 4.3,
        "sodium_mg": 294,
        "added_sugar_g": 0,
        "fiber_g": 0
      },
      "unit_conversions": {
        "cup": 135,
        "g": 1,
        "oz": 28.35,
        "serving": 135
      },
      "allergens": [
        "fish"
      ],
      "food_groups": [
        "fats",
        "protein"
      ],
      "source_refs": [
        {
          "source": "fndds-2021-2023",
          "source_id": "26137120",
          "data_type": "FNDDS At A Glance",
          "note": "2402 Fish"
        }
      ]
    },
    {
      "food_id": "sweet_potato_baked",
      "name": "sweet potato",
      "aliases": [
        "baked sweet potato",
        "Sweet potato, baked, no added fat"
      ],
      "base_quantity_g": 100,
      "nutrients_per_100g": {
        "energy_kcal": 82,
        "protein_g": 1.6,
        "carbohydrate_g": 18.0,
        "fat_g": 0.4,
        "saturated_fat_g": 0.0,
        "sodium_mg": 154,
        "added_sugar_g": 0,
        "fiber_g": 3.1
      },
      "unit_conversions": {
        "cup": 250,
        "g": 1,
        "large": 235,
        "medium": 150,
        "oz": 28.35,
        "serving": 250,
        "small": 80
      },
      "allergens": [],
      "food_groups": [
        "fruits",
        "vegetables"
      ],
      "source_refs": [
        {
          "source": "fndds-2021-2023",
          "source_id": "73403010",
          "data_type": "FNDDS At A Glance",
          "note": "6406 Other red and orange vegetables"
        }
      ]
    },
    {
      "food_id": "spinach_cooked",
      "name": "spinach",
      "aliases": [
        "cooked spinach",
        "Spinach, fresh, cooked, no added fat"
      ],
      "base_quantity_g": 100,
      "nutrients_per_100g": {
        "energy_kcal": 33,
        "protein_g": 3.4,
        "carbohydrate_g": 3.1,
        "fat_g": 0.7,
        "saturated_fat_g": 0.1,
        "sodium_mg": 262,
        "added_sugar_g": 0,
        "fiber_g": 1.9
      },
      "unit_conversions": {
        "cup": 180,
        "g": 1,
        "oz": 28.35,
        "serving": 180
      },
      "allergens": [],
      "food_groups": [
        "vegetables"
      ],
      "source_refs": [
        {
          "source": "fndds-2021-2023",
          "source_id": "72125211",
          "data_type": "FNDDS At A Glance",
          "note": "6409 Spinach"
        }
      ]
    },
    {
      "food_id": "olive_oil",
      "name": "olive oil",
      "aliases": [
        "extra virgin olive oil"
      ],
      "base_quantity_g": 100,
      "nutrients_per_100g": {
        "energy_kcal": 900,
        "protein_g": 0,
        "carbohydrate_g": 0,
        "fat_g": 100,
        "saturated_fat_g": 15.5,
        "sodium_mg": 2,
        "added_sugar_g": 0,
        "fiber_g": 0
      },
      "unit_conversions": {
        "cup": 224,
        "g": 1,
        "oz": 28.35,
        "serving": 224,
        "tbsp": 14
      },
      "allergens": [],
      "food_groups": [
        "fats",
        "vegetables"
      ],
      "source_refs": [
        {
          "source": "fndds-2021-2023",
          "source_id": "82104000",
          "data_type": "FNDDS At A Glance",
          "note": "8012 Salad dressings and vegetable oils"
        }
      ]
    },
    {
      "food_id": "egg_boiled",
      "name": "boiled egg",
      "aliases": [
        "egg",
        "hard boiled egg",
        "Egg, whole, boiled or poached"
      ],
      "base_quantity_g": 100,
      "nutrients_per_100g": {
        "energy_kcal": 143,
        "protein_g": 12.4,
        "carbohydrate_g": 1.0,
        "fat_g": 10.0,
        "saturated_fat_g": 3.2,
        "sodium_mg": 129,
        "added_sugar_g": 0,
        "fiber_g": 0
      },
      "unit_conversions": {
        "cup": 135,
        "egg": 50,
        "g": 1,